{
  "assetId": "bld_m_house.interior",
  "importCommandPath": "generated/jobs/fable5_prefab_bld_m_house_interior_512102244bae5f00d91d/intake-guide.md",
  "jobId": "fable5_prefab_bld_m_house_interior_512102244bae5f00d91d",
  "outputContractPath": "generated/jobs/fable5_prefab_bld_m_house_interior_512102244bae5f00d91d/output-contract.json",
  "promptPath": "generated/jobs/fable5_prefab_bld_m_house_interior_512102244bae5f00d91d/prompt.md",
  "referenceIds": [
    "user_target_town_current",
    "user_building_houses_shops_ruins"
  ],
  "schemaVersion": 1,
  "status": "job-pack"
}
